,headline,date,number of tokens,1,1 hl ratio,2,2 hl ratio,3,3 hl ratio,4,4 hl ratio,5,5 hl ratio,6,6 hl ratio,7,7 hl ratio
0,"[u'come', u'?']",2014-07-29,2,0,0.0,0,0.0,0,0.0,0,0.0,0,0.0,0,0.0,0,0.0
1,"[u'worst', u'virus', u'outbreak', u'ever', u'ravaging', u'liberia', u'sierra', u'leone', u'guinea', u'.', u'far', u'disease', u'killed', u'670', u'people', u'infected', u'1', u'000', u'...', u'deadly', u'virus', u'likely', u'hit', u'us', u'spread']",2014-07-29,25,1,0.04,0,0.0,4,0.16,1,0.04,1,0.04,2,0.08,1,0.04
2,"[u'outbreak', u':', u'asky', u'bans', u'flights', u'west', u'africa']",2014-07-29,7,0,0.0,0,0.0,1,0.142857142857,0,0.0,0,0.0,0,0.0,0,0.0
3,"[u'public', u'health', u'adviser', u'yewande', u'adeshina', u'said', u'30000', u'people', u'risk', u'...', u'in-depth', u'-']",2014-07-29,12,0,0.0,0,0.0,0,0.0,0,0.0,0,0.0,1,0.0833333333333,0,0.0
4,"[u'politics', u'-', u'(', u')']",2014-07-29,4,0,0.0,0,0.0,0,0.0,0,0.0,0,0.0,0,0.0,0,0.0
5,"[u'plane', u'travel', u'scare', u'officials', u'edge', u'in-depth', u'-']",2014-07-29,7,0,0.0,0,0.0,0,0.0,0,0.0,0,0.0,0,0.0,0,0.0
6,"[u'(', u')', u'forbes', u'azaria', u'marthyman', u'doctor', u'returns', u'home', u'victoria']",2014-07-29,9,0,0.0,0,0.0,0,0.0,0,0.0,1,0.111111111111,0,0.0,0,0.0
7,"[u'dr.', u'azaria', u'marthyman', u'victoria', u'doctor', u'part', u'medical', u'group', u'travelled', u'liberia', u'earlier', u'month', u'treat', u'victims', u'virus', u'returned', u'...', u'victoria', u'doctor', u'places', u'quarantine', u'treating', u'...', u'international', u'-', u'global.ca']",2014-07-29,26,0,0.0,0,0.0,0,0.0,0,0.0,2,0.0769230769231,1,0.0384615384615,1,0.0384615384615
8,"[u'related', u'story', u':', u'doctor', u'leading', u'sierra', u'leone', u""'s"", u'fight', u'...', u'online']",2014-07-29,11,0,0.0,0,0.0,2,0.181818181818,0,0.0,1,0.0909090909091,0,0.0,0,0.0
9,"[u'believed', u'killed', u'672', u'people', u'guinea', u'liberia', u'sierra', u'leone', u'since', u'outbreak', u'began', u'february', u'according', u'world', u'health', u'...', u'conspiracy', u'theories', u'spreading', u'fast', u'outbreak', u'travels', u'round', u'...']",2014-07-29,24,1,0.0416666666667,0,0.0,3,0.125,0,0.0,0,0.0,2,0.0833333333333,0,0.0
10,"[u'sierra', u'leone', u'largest', u'number', u'cases', u'thousands', u'protested', u'outside', u'country', u""'s"", u'main', u'treatment', u'facility', u'eastern', u'city', u'...', u'outbreak', u':', u'liberia', u'suspends', u'football']",2014-07-29,21,0,0.0,0,0.0,2,0.0952380952381,0,0.0,0,0.0,0,0.0,0,0.0
11,"[u'liberia', u'suspended', u'football', u'activities', u'effort', u'control', u'spread', u'deadly', u'virus', u'.', u'risk', u'infection', u'football', u'contact', u'...', u'outbreak', u':', u'doctors', u'needed', u'contain', u'west', u'africa', u""'s"", u'...', u'in-depth', u'-']",2014-07-29,26,1,0.0384615384615,0,0.0,3,0.115384615385,0,0.0,0,0.0,0,0.0,0,0.0
12,"[u'epidemic', u'happen', u'us', u'reason', u'(', u')']",2014-07-29,6,0,0.0,0,0.0,0,0.0,1,0.166666666667,0,0.0,0,0.0,0,0.0
13,"[u'sierraexpressmediausa', u'today', u'features', u'slightly', u'alarming', u'headline', u':', u'plane', u'ride', u'away', u'usa', u'.', u'course', u'true', u'...', u'ncaa', u'suspends', u'asky', u'airlines', u'flying', u'virus', u'victim', u'...', u'bella', u'naija']",2014-07-29,25,0,0.0,0,0.0,0,0.0,0,0.0,0,0.0,0,0.0,0,0.0
14,"[u'ikeja', u'(', u'nan', u')', u'\u2015', u'nigerian', u'civil', u'aviation', u'authority', u'(', u'ncaa', u')', u'suspended', u'asky', u'airline', u'flight', u'operations', u'nigeria', u'transportation', u'virus', u'...', u':', u""'it"", u""'s"", u'close', u""'s"", u'front', u'door', u""'"", u'wnd', u'.']",2014-07-29,31,0,0.0,1,0.0322580645161,0,0.0,0,0.0,0,0.0,0,0.0,0,0.0
15,"[u'patrick', u'sawyer', u'infected', u'man', u'boarded', u'international', u'flight', u'last', u'week', u'carrying', u'deadly', u'virus', u'set', u'alarms', u'disease', u'escaping', u'...', u'social', u'media', u'help', u'prevent', u'spread', u'?']",2014-07-29,23,1,0.0434782608696,0,0.0,1,0.0434782608696,0,0.0,1,0.0434782608696,1,0.0434782608696,1,0.0434782608696
16,"[u'west', u'africa', u'grip', u'world', u""'s"", u'deadliest', u'outbreak', u'many', u'region', u'using', u'social', u'media', u'educate', u'symptoms', u'...', u':', u'nigeria', u'woods', u'yet', u'\u2014', u'prof.', u'tomori', u'vanguard']",2014-07-29,23,1,0.0434782608696,1,0.0434782608696,1,0.0434782608696,0,0.0,0,0.0,1,0.0434782608696,0,0.0
17,"[u'fears', u'hit', u'close', u'home']",2014-07-30,4,0,0.0,0,0.0,0,0.0,0,0.0,0,0.0,0,0.0,0,0.0
18,"[u'sawyer', u'first', u'american', u'die', u'health', u'officials', u'calling', u'``', u'deadliest', u'outbreak', u'history', u'.', u""''"", u'death', u'sparked', u'concerns', u'virus', u'...', u':', u'spider', u""'s"", u'web', u'infection', u'growing', u'hunt', u'continues', u'...']",2014-07-30,27,0,0.0,0,0.0,0,0.0,0,0.0,1,0.037037037037,0,0.0,1,0.037037037037
19,"[u""'we"", u'need', u""'"", u':', u'fight', u'thin', u'ground', u'in-depth', u'-', u'.']",2014-07-30,10,0,0.0,0,0.0,0,0.0,0,0.0,0,0.0,0,0.0,0,0.0
20,"[u'congressman', u':', u'close', u'border', u'countries', u'opinion', u'-', u'u.s.', u'&', u'world', u'report']",2014-07-30,11,4,0.363636363636,0,0.0,0,0.0,0,0.0,0,0.0,1,0.0909090909091,0,0.0
21,"[u'poverty', u'root', u'west', u'africa', u""'s"", u'crisis', u'-', u'channel', u'4', u'(', u')']",2014-07-30,11,1,0.0909090909091,0,0.0,2,0.181818181818,0,0.0,0,0.0,0,0.0,0,0.0
22,"[u'outbreak', u':', u'us', u'peace', u'corps', u'evacuates', u'liberia', u'closes', u'schools', u'in-depth', u'-']",2014-07-30,11,0,0.0,0,0.0,0,0.0,1,0.0909090909091,0,0.0,0,0.0,0,0.0
23,"[u'u.s.', u'&', u'world', u'report', u'america', u'quartz', u'virus', u':', u'risk', u'outbreak', u'spreading', u'australia', u'low', u'chief', u'...', u'online']",2014-07-30,16,2,0.125,0,0.0,0,0.0,0,0.0,1,0.0625,1,0.0625,0,0.0
24,"[u'risk', u'deadly', u'virus', u'spreading', u'australia', u'west', u'africa', u'low', u'commonwealth', u'chief', u'medical', u'officer', u'said', u'.', u'almost', u'700', u'people', u'...', u'within', u'next', u'days', u'know', u'kent', u'brantly', u'nancy', u'...']",2014-07-30,26,2,0.0769230769231,0,0.0,2,0.0769230769231,0,0.0,2,0.0769230769231,1,0.0384615384615,0,0.0
25,"[u'two', u'american', u'doctors', u'battling', u'virus', u'entering', u""'critical"", u""'"", u'phase', u'treatment', u'head', u'charity', u'sent', u'liberia', u'revealed', u'...', u'american', u'doctor', u""'terrified"", u""'"", u'catching', u'disease', u'trying', u'...']",2014-07-30,24,0,0.0,0,0.0,0,0.0,0,0.0,3,0.125,1,0.0416666666667,0,0.0
26,"[u'need', u'know', u'virus', u'wwlp', u'.']",2014-07-30,5,1,0.2,0,0.0,0,0.0,0,0.0,0,0.0,0,0.0,0,0.0
27,"[u'wwlp', u'.', u'uk', u'.', u':', u'doctor', u'quarantined', u'canada', u'breitbart']",2014-07-30,9,0,0.0,0,0.0,0,0.0,0,0.0,1,0.111111111111,0,0.0,0,0.0
28,"[u'(', u'afp', u')', u'\u2014', u'canadian', u'doctor', u'put', u'quarantine', u'precaution', u'spending', u'weeks', u'west', u'africa', u'treating', u'patients', u'deadly', u'virus', u'...', u':', u'nhs', u'deal', u'threat', u'uk', u'says', u'philip', u'hammond']",2014-07-30,26,1,0.0384615384615,0,0.0,2,0.0769230769231,2,0.0769230769231,1,0.0384615384615,1,0.0384615384615,0,0.0
29,"[u'uk', u""'s"", u'health', u'services', u'experience', u'deal', u'threat', u'posed', u'virus', u'foreign', u'secretary', u'philip', u'hammond', u'said', u'.', u'mr', u'hammond', u'said', u'...', u'death', u'key', u'doctor', u'damages', u'fight', u'sierra', u'...', u'public', u'radio', u'international']",2014-07-30,29,0,0.0,0,0.0,1,0.0344827586207,0,0.0,1,0.0344827586207,0,0.0,0,0.0
30,"[u'outbreak', u':', u'pan-african', u'airline', u'halts', u'flights', u'west', u'african', u'...']",2014-07-30,9,0,0.0,0,0.0,1,0.111111111111,0,0.0,0,0.0,0,0.0,0,0.0
31,"[u'``', u'suspension', u'flights', u'freetown', u'monrovia', u'asky', u'related', u'fight', u'spread', u'virus', u'``', u'said', u'afoussath', u'traore', u'spokesman', u'...', u'crisis', u':', u'done', u'stop', u'spread', u'?']",2014-07-30,22,1,0.0454545454545,0,0.0,1,0.0454545454545,0,0.0,0,0.0,0,0.0,0,0.0
32,"[u'two', u'american', u'missionaries', u'fighting', u'life', u'virus', u'...', u'christian', u'post']",2014-07-30,9,0,0.0,0,0.0,0,0.0,0,0.0,1,0.111111111111,0,0.0,0,0.0
33,"[u':', u'liberia', u'shuts', u'schools', u'tackle', u'outbreak']",2014-07-30,6,0,0.0,0,0.0,0,0.0,0,0.0,0,0.0,0,0.0,0,0.0
34,"[u'liberia', u""'s"", u'government', u'announced', u'closing', u'schools', u'across', u'country', u'stop', u'spread', u'deadly', u'virus', u'.', u'munities', u'would', u'...', u'outbreak', u':', u'british', u'doctor', u'tells', u'medics', u'risk', u'lives', u'treat', u'...']",2014-07-30,26,1,0.0384615384615,0,0.0,1,0.0384615384615,0,0.0,1,0.0384615384615,0,0.0,1,0.0384615384615
35,"[u'british', u'doctor', u'went', u'treat', u'victims', u'africa', u'told', u'medics', u'put', u'...', u'dozens', u'health', u'workers', u'died', u'treating', u'patients', u'dr', u'spencer', u'...', u'survivor', u':', u""'i"", u'terribly', u'afraid', u""'""]",2014-07-30,25,0,0.0,1,0.04,1,0.04,2,0.08,1,0.04,0,0.0,2,0.08
36,"[u'canada', u""'concerned"", u""'"", u'outbreak', u'risk', u'country', u'low', u'...', u'ctv']",2014-07-30,9,0,0.0,0,0.0,0,0.0,0,0.0,0,0.0,0,0.0,0,0.0
37,"[u'international', u'health', u'officials', u'scramble', u'contain', u'deadly', u'outbreak', u'west', u'africa', u'canadian', u'border', u'agents', u'alert', u'signs', u'illness', u'...', u'official', u':', u'preliminary', u'test', u'cmc', u'patient', u'shows', u'malaria', u'wsoc', u'charlotte']",2014-07-30,26,2,0.0769230769231,0,0.0,3,0.115384615385,2,0.0769230769231,0,0.0,0,0.0,0,0.0
38,"[u'passaretti', u'said', u'determined', u'patient', u'.', u'patient', u'discharged', u'home', u'.', u""'there"", u'great', u'munication', u'hospital', u'...', u'patient', u'traveling', u'africa', u'prompts', u'scare', u'cmc', u'charlotte', u'observer']",2014-07-30,22,0,0.0,1,0.0454545454545,1,0.0454545454545,3,0.136363636364,0,0.0,0,0.0,0,0.0
39,"[u'outbreak', u'became', u'deadliest', u'history']",2014-07-31,4,0,0.0,0,0.0,0,0.0,0,0.0,0,0.0,0,0.0,0,0.0
40,"[u'reasons', u'outbreak', u'west', u'africa', u'grown', u'large', u'happening', u'may', u'travel', u'patterns', u'bats', u'across', u'...', u'director-general', u'west', u'african', u'presidents', u'launch', u'intensified', u'...', u'world', u'health', u'organization', u'(', u'press', u'release', u')']",2014-07-31,27,1,0.037037037037,0,0.0,2,0.0740740740741,0,0.0,0,0.0,1,0.037037037037,0,0.0
41,"[u'seychelles', u'afcon', u'2015', u'race', u'international', u'-', u'sierra', u'express', u'media']",2014-07-31,9,0,0.0,0,0.0,1,0.111111111111,0,0.0,0,0.0,0,0.0,0,0.0
42,"[u'source', u':', u'flight', u'en', u'route', u'liberia', u'evacuate', u'americans', u'infected', u'...', u'in-depth', u'-']",2014-07-31,12,1,0.0833333333333,1,0.0833333333333,0,0.0,1,0.0833333333333,2,0.166666666667,0,0.0,1,0.0833333333333
43,"[u'virus', u'outbreak', u':', u'sierra', u'leone', u'liberia', u'announce', u'army', u'...', u'opinion', u'-', u'belfast', u'telegraph']",2014-07-31,13,1,0.0769230769231,0,0.0,2,0.153846153846,0,0.0,0,0.0,0,0.0,0,0.0
44,"[u'peace', u'corps', u'pulls', u'volunteers', u'countries', u'involved', u'...', u'-', u'(', u')']",2014-07-31,10,0,0.0,0,0.0,0,0.0,0,0.0,0,0.0,0,0.0,0,0.0
45,"[u'(', u'india', u')', u'vice', u'(', u')', u'emergency', u'efforts', u'africa', u'contain', u'toll', u'rises']",2014-07-31,12,1,0.0833333333333,2,0.166666666667,2,0.166666666667,0,0.0,0,0.0,0,0.0,0,0.0
46,"[u'abuja', u'nigeria', u'\u2014', u'death', u'toll', u'mounted', u'worst', u'outbreak', u'virus', u'west', u'african', u'leaders', u'quickened', u'pace', u'emergency', u'efforts', u'...', u'taxis', u'planes', u'viruses', u':', u'deadly', u'spread', u'week']",2014-07-31,24,2,0.0833333333333,2,0.0833333333333,2,0.0833333333333,0,0.0,0,0.0,0,0.0,0,0.0
47,"[u'rages', u'africa', u'west', u'agonises', u'ethics', u'vaccine', u'...']",2014-07-31,7,0,0.0,1,0.142857142857,1,0.142857142857,1,0.142857142857,0,0.0,0,0.0,0,0.0
48,"[u""'s"", u'cure', u'early', u'intensive', u'treatment', u'boosts', u'survival', u'healthday']",2014-07-31,8,0,0.0,0,0.0,0,0.0,0,0.0,0,0.0,0,0.0,0,0.0
49,"[u'us', u'embassies', u'west', u'africa', u'stay', u'open', u'despite', u'warning']",2014-07-31,8,0,0.0,0,0.0,1,0.125,1,0.125,0,0.0,0,0.0,0,0.0
50,"[u'cyclist', u'mohamed', u'tholley', u'due', u'pete', u'time', u'trial', u'event', u'...', u'in-depth', u'-']",2014-07-31,11,0,0.0,0,0.0,0,0.0,0,0.0,0,0.0,0,0.0,0,0.0
51,"[u'week', u'healthday', u'local', u'enough', u'one', u':', u'experimental', u'serum', u'used', u'us', u'patient', u'.']",2014-07-31,12,0,0.0,2,0.166666666667,1,0.0833333333333,3,0.25,0,0.0,0,0.0,0,0.0
52,"[u'\u201chowever', u'dr.', u'brantly', u'received', u'unit', u'blood', u'14-year-old', u'boy', u'survived', u'dr.', u'brantly', u""'s"", u'care', u'.', u'young', u'boy', u'family', u'...', u'patient', u'ing', u'us', u'aid', u'workers', u""'"", u'health', u'worsens']",2014-07-31,26,0,0.0,0,0.0,0,0.0,2,0.0769230769231,2,0.0769230769231,0,0.0,0,0.0
53,"[u'-stricken', u'doc', u'gives', u""'experimental"", u'serum', u""'"", u'coworker']",2014-07-31,7,0,0.0,1,0.142857142857,0,0.0,0,0.0,1,0.142857142857,0,0.0,0,0.0
54,"[u""n't"", u'vaccine']",2014-07-31,2,0,0.0,1,0.5,0,0.0,0,0.0,0,0.0,0,0.0,0,0.0
55,"[u'cases', u'rare', u'drug', u'manufacturers', u""n't"", u'interested', u'investing', u'finding', u'vaccine', u'schaffner', u'said', u'.', u'addition', u""'s"", u'rarity', u'makes', u'...', u'plane', u'sent', u'africa', u'bring', u'-infected', u'americans', u'home', u'q13', u'fox']",2014-07-31,26,0,0.0,2,0.0769230769231,1,0.0384615384615,1,0.0384615384615,0,0.0,0,0.0,0,0.0
56,"[u'dr.', u'kent', u'brantly', u'medical', u'director', u'samaritan', u""'s"", u'purse', u'consolidated', u'case', u'management', u'center', u'monrovia', u'liberia', u'tested', u'positive', u'...', u':', u'virus', u'quick', u'death', u':', u'socio-economic', u'implications', u'...', u'liberian', u'dialogue']",2014-07-31,27,0,0.0,0,0.0,0,0.0,1,0.037037037037,2,0.0740740740741,0,0.0,0,0.0
57,"[u'see', u'liberians', u'continue', u'die', u'deadly', u'disease', u'simply', u'county', u'proactive', u'.', u'country', u'fire-truck', u'approach', u'.', u'...', u'doctor', u'infected', u'makes', u'selfless', u'gesture', u'fellow', u'patient']",2014-07-31,22,1,0.0454545454545,0,0.0,1,0.0454545454545,1,0.0454545454545,2,0.0909090909091,1,0.0454545454545,2,0.0909090909091
58,"[u':', u'uk', u'border', u'staff', u""'unprepared"", u""'"", u'rt']",2014-07-31,7,2,0.285714285714,0,0.0,0,0.0,0,0.0,0,0.0,0,0.0,0,0.0
59,"[u'immigration', u'border', u'staff', u'reportedly', u'deeply', u'concerned', u'risks', u'carriers', u'entering', u'uk', u'pose', u'health', u'.', u'(', u'/', u'neil', u'hall', u')', u'/', u'.', u'outbreak', u':', u'uk', u'border', u'prepared', u'virus', u'warns', u'immigration', u'...']",2014-07-31,29,2,0.0689655172414,0,0.0,0,0.0,0,0.0,0,0.0,0,0.0,0,0.0
60,"[u'uk', u'border', u'staff', u""'unprepared"", u""'"", u'sky']",2014-07-31,6,1,0.166666666667,0,0.0,0,0.0,0,0.0,0,0.0,0,0.0,0,0.0
61,"[u':', u'uk', u'border', u'staff', u""'unprepared"", u""'"", u'says', u'union', u'leader', u'highly', u'cited', u'-']",2014-07-31,12,1,0.0833333333333,0,0.0,0,0.0,1,0.0833333333333,0,0.0,0,0.0,0,0.0
62,"[u'nigerian', u'official', u'warns', u'pastors', u'healers', u'stop', u'making', u'false', u'...']",2014-07-31,9,0,0.0,0,0.0,0,0.0,0,0.0,0,0.0,0,0.0,0,0.0
63,"[u'african', u'governments', u'doubling', u'efforts', u'contain', u'widening', u'outbreak', u'west', u'africa', u'also', u'involves', u'bating', u'rumors', u'falsehoods', u'...', u'ph', u'procedures', u'track', u'prevent', u'spread', u'\u2014', u'doh', u'inquirer.net']",2014-07-31,23,0,0.0,0,0.0,3,0.130434782609,0,0.0,0,0.0,0,0.0,0,0.0
64,"[u'manila', u'philippines', u'\u2014', u'deadly', u'virus', u'reportedly', u'infected', u'1', u'200', u'mostly', u'west', u'africa', u'left', u'least', u'670', u'dead', u'across', u'region', u'...', u'doh', u':', u'philippines', u'ready', u'virus', u'centrio']",2014-07-31,25,2,0.08,0,0.0,3,0.12,0,0.0,1,0.04,0,0.0,1,0.04
65,"[u'american', u'dies', u'liberia', u'outbreak', u'closes', u'borders']",2014-07-31,6,0,0.0,0,0.0,0,0.0,0,0.0,1,0.166666666667,0,0.0,1,0.166666666667
66,"[u'young', u'american', u'man', u'died', u'wednesday', u'liberia', u'outbreak', u'deadly', u'virus', u'reached', u'historic', u'levels', u'.', u'family', u'said', u""n't"", u'...', u'brother', u'md', u'.', u'man', u'died', u'liberia', u'remembers', u'final', u'words', u'local']",2014-07-31,27,1,0.037037037037,0,0.0,1,0.037037037037,0,0.0,1,0.037037037037,0,0.0,0,0.0
67,"[u'crisis', u':', u'virus', u'spreading', u'fast', u'says']",2014-08-01,6,1,0.166666666667,0,0.0,1,0.166666666667,1,0.166666666667,0,0.0,0,0.0,0,0.0
68,"[u'outbreak', u'west', u'africa', u'spreading', u'faster', u'efforts', u'control', u'world', u'health', u'organization', u'(', u')', u'head', u'margaret', u'chan', u'said', u'.', u'told', u'...', u'virus', u'outpacing', u'efforts', u'control', u'world', u'health', u'body', u'warns']",2014-08-01,27,2,0.0740740740741,0,0.0,1,0.037037037037,0,0.0,0,0.0,2,0.0740740740741,0,0.0
69,"[u'warns', u""'catastrophic"", u""'"", u'consequences', u'(', u'india', u')']",2014-08-01,7,0,0.0,1,0.142857142857,0,0.0,0,0.0,0,0.0,0,0.0,0,0.0
70,"[u'mapping', u'acceleration', u'west', u'africa', u'five', u'charts', u'quartz']",2014-08-01,7,0,0.0,0,0.0,1,0.142857142857,0,0.0,0,0.0,0,0.0,0,0.0
71,"[u'exposure', u'health', u'workers', u'weakens', u'africa', u""'s"", u'fight', u'in-depth', u'-']",2014-08-01,9,0,0.0,0,0.0,1,0.111111111111,0,0.0,0,0.0,0,0.0,0,0.0
72,"[u'moving', u'faster', u'control', u'efforts', u'in-depth', u'-']",2014-08-01,6,0,0.0,0,0.0,0,0.0,0,0.0,0,0.0,0,0.0,0,0.0
73,"[u'(', u'india', u')', u'geek', u'plos', u'(', u')', u'need', u'fight']",2014-08-01,9,0,0.0,1,0.111111111111,0,0.0,0,0.0,0,0.0,0,0.0,0,0.0
74,"[u'outbreaks', u'occurred', u'africa', u'two', u'dozen', u'occasions', u'past', u'40', u'years', u'brought', u'control', u'every', u'time', u'.', u'...', u'spreads', u':', u'important', u'facts', u'disease', u'transmission', u'post-standard']",2014-08-01,22,0,0.0,0,0.0,1,0.0454545454545,0,0.0,0,0.0,1,0.0454545454545,0,0.0
75,"[u'parts', u'africa', u'throes', u'deadliest', u'outbreak', u'...', u'4', u'washington']",2014-08-01,8,0,0.0,0,0.0,1,0.125,0,0.0,0,0.0,0,0.0,0,0.0
76,"[u'us', u'scrambles', u'retrieve', u'patients', u'in-depth', u'-', u'.']",2014-08-01,7,0,0.0,0,0.0,0,0.0,2,0.285714285714,0,0.0,0,0.0,0,0.0
77,"[u""'s"", u'frontline', u':', u'battling', u'fear', u'deadly', u'virus', u'opinion', u'-']",2014-08-01,9,2,0.222222222222,0,0.0,1,0.111111111111,0,0.0,0,0.0,0,0.0,0,0.0
78,"[u'official', u':', u'virus', u""'extraordinarily"", u'unlikely', u""'"", u'spread', u'us', u'in-depth', u'-']",2014-08-01,10,0,0.0,0,0.0,0,0.0,1,0.1,0,0.0,0,0.0,0,0.0
79,"[u'post-standard', u'4', u'washington', u'.', u'department', u'defense', u'serum', u':', u'explaining', u'americans', u""'"", u'experimental', u'treatments']",2014-08-01,13,0,0.0,2,0.153846153846,0,0.0,1,0.0769230769231,0,0.0,0,0.0,0,0.0
80,"[u'outbreak', u'largest', u'history', u'far', u'claimed', u'729', u'lives', u'...', u'treatments', u'vaccines', u'available', u'though', u'several', u'...', u'happens', u'patients', u'arrive', u'us']",2014-08-01,18,0,0.0,0,0.0,0,0.0,2,0.111111111111,1,0.0555555555556,0,0.0,0,0.0
81,"[u'first', u'case', u'diagnosed', u'us', u':', u""'s"", u""n't"", u'need', u'panic', u'in-depth', u'-']",2014-08-01,11,0,0.0,0,0.0,0,0.0,1,0.0909090909091,0,0.0,0,0.0,0,0.0
82,"[u'patients', u'soon', u'expected', u'arrive', u'united', u'states', u'in-depth', u'-']",2014-08-01,8,0,0.0,0,0.0,0,0.0,1,0.125,1,0.125,0,0.0,0,0.0
83,"[u'vaccine', u'possible', u'many', u'doubts', u'persist']",2014-08-01,5,0,0.0,1,0.2,0,0.0,0,0.0,0,0.0,0,0.0,0,0.0
84,"[u'virus', u'\u201ca', u'survivor', u'\u201d', u'said', u'john', u'dye', u'chief', u'viral', u'immunology', u'branch', u'united', u'states', u'army', u'medical', u'research', u'institute', u'infectious', u'diseases', u'.', u'outbreak', u'could', u'spur', u'action', u'md', u'.', u'scientists', u'working', u'vaccine']",2014-08-01,29,0,0.0,1,0.0344827586207,0,0.0,0,0.0,0,0.0,0,0.0,0,0.0
85,"[u'us', u'hospitals', u'keep', u'deadly', u'germs', u'like', u'virus', u'contained']",2014-08-01,8,1,0.125,0,0.0,1,0.125,1,0.125,0,0.0,0,0.0,0,0.0
86,"[u'plans', u'underway', u'bring', u'one', u'two', u'americans', u'stricken', u'united', u'states', u'people', u'wondering', u'happen', u'without', u'unleashing', u'...', u'tenn.', u'man', u'quarantine', u'outbreak', u':', u""'i"", u""'m"", u'feeling', u'well', u""'""]",2014-08-01,25,0,0.0,0,0.0,1,0.04,0,0.0,0,0.0,2,0.08,0,0.0
87,"[u'tennessee', u'doctor', u'placed', u'quarantine', u'volunteering', u'west', u'africa', u'virus', u'rampant', u'says', u""'s"", u'``', u'feeling', u'well', u""''"", u'showing', u'...', u'atlanta', u'doctors', u'gear', u'treat', u'two', u'patients']",2014-08-01,23,0,0.0,0,0.0,1,0.0434782608696,2,0.0869565217391,2,0.0869565217391,1,0.0434782608696,1,0.0434782608696
88,"[u'medical', u'transport', u'plane', u'en', u'route', u'pick', u'two', u'americans', u'sick', u'liberia', u'doctors', u'atlanta', u'said', u'friday', u'.', u'frequently', u'asked', u'questions', u'virus', u'...', u'wabe', u'90.1', u'fm']",2014-08-01,23,1,0.0434782608696,1,0.0434782608696,0,0.0,1,0.0434782608696,2,0.0869565217391,0,0.0,0,0.0
89,"[u'patients', u'coming', u'us', u':', u'safe', u'?']",2014-08-01,6,0,0.0,0,0.0,0,0.0,2,0.333333333333,0,0.0,0,0.0,0,0.0
90,"[u'two', u'americans', u'battling', u'deadly', u'virus', u'evacuated', u'africa', u'plan', u'fly', u'u.s.', u'hospitals', u'receive', u'treatment', u'.', u'tom', u'chivers', u':', u'curse', u'opinion', u'-', u'national', u'post']",2014-08-01,22,2,0.0909090909091,0,0.0,2,0.0909090909091,0,0.0,0,0.0,0,0.0,0,0.0
91,"[u'5pm', u':', u'274', u'lds', u'missionaries', u'-affected', u'areas', u'transferred', u'ksl', u'.']",2014-08-01,10,0,0.0,0,0.0,0,0.0,0,0.0,0,0.0,0,0.0,0,0.0
92,"[u'virus', u'transmitted', u'people', u'wild', u'animals', u'spreads', u'human-to-human', u'transmission', u'contact', u'blood', u'secretions', u'organs', u'...', u'forces', u'300', u'peace', u'corps', u'volunteers', u'3', u'west', u'african', u'nations', u'masslive', u'.']",2014-08-01,24,0,0.0,0,0.0,2,0.0833333333333,0,0.0,0,0.0,1,0.0416666666667,0,0.0
93,"[u'virus', u'mutation', u'made', u'2014', u'outbreak', u'deadly']",2014-08-02,6,1,0.166666666667,0,0.0,1,0.166666666667,0,0.0,0,0.0,0,0.0,0,0.0
94,"[u'worst', u'outbreak', u'virus', u'history', u'\u2014', u'happening', u'west', u'africa', u'\u2014', u'claimed', u'700', u'lives', u'according', u'latest', u'count', u'world', u'...', u'ambulance', u'carrying', u'first', u'american', u'victim', u'arrives', u'emory', u'wsb', u'atlanta']",2014-08-02,26,1,0.0384615384615,0,0.0,1,0.0384615384615,0,0.0,3,0.115384615385,1,0.0384615384615,0,0.0
95,"[u'world', u'turns', u'attention', u'west', u'african', u'crisis']",2014-08-02,6,2,0.333333333333,0,0.0,2,0.333333333333,0,0.0,0,0.0,1,0.166666666667,0,0.0
96,"[u'chan', u'made', u'point', u'telling', u'west', u'african', u'presidents', u'alone', u'fight', u';', u'world', u'.', u'next', u'week', u'...', u'largest', u'ever', u'outbreak', u'global', u'threat']",2014-08-02,20,1,0.05,0,0.0,1,0.05,0,0.0,0,0.0,1,0.05,0,0.0
97,"[u'russian', u'virologists', u'join', u'battle', u""'deadliest"", u'outbreak', u'ever', u""'"", u'rt']",2014-08-02,9,1,0.111111111111,0,0.0,0,0.0,0,0.0,0,0.0,0,0.0,0,0.0
98,"[u'may', u'never', u'cure']",2014-08-02,3,0,0.0,0,0.0,0,0.0,0,0.0,0,0.0,0,0.0,0,0.0
99,"[u'outbreak', u':', u'sierra', u'leone', u'athletes', u'frightened', u'go', u'home', u'...']",2014-08-02,9,0,0.0,0,0.0,2,0.222222222222,0,0.0,0,0.0,0,0.0,0,0.0
100,"[u'things', u'know', u'outbreak', u'-', u'(', u')']",2014-08-02,6,1,0.166666666667,0,0.0,0,0.0,0,0.0,0,0.0,0,0.0,0,0.0
101,"[u'(', u')', u'rt', u'hindustan', u'us|american', u'doctor', u'arrives', u'us', u'treatment']",2014-08-02,9,1,0.111111111111,0,0.0,0,0.0,1,0.111111111111,2,0.222222222222,0,0.0,0,0.0
102,"[u'atlanta', u'\u2014', u'first', u'two', u'american', u'aid', u'workers', u'infected', u'working', u'west', u'africa', u'arrived', u'united', u'states', u'saturday', u'aboard', u'private', u'air', u'...', u'family', u'doctor', u'optimistic', u'recovery']",2014-08-02,23,0,0.0,0,0.0,1,0.0434782608696,0,0.0,4,0.173913043478,0,0.0,1,0.0434782608696
103,"[u'safe', u'bring', u'victims', u'us', u'?', u'in-depth', u'-', u'.']",2014-08-02,8,0,0.0,0,0.0,0,0.0,1,0.125,0,0.0,0,0.0,0,0.0
104,"[u'first', u'american', u'patient', u'arrives', u'us', u'africa', u'in-depth', u'-']",2014-08-02,8,0,0.0,0,0.0,1,0.125,2,0.25,2,0.25,0,0.0,0,0.0
105,"[u'.', u'treating', u'experimental', u'serum', u'might', u'help']",2014-08-02,6,0,0.0,2,0.333333333333,0,0.0,1,0.166666666667,0,0.0,0,0.0,0,0.0
106,"[u'last', u'week', u'learned', u'two', u'americans', u'working', u'liberia', u'medical', u'charity', u'samaritan', u""'s"", u'purse', u'among', u'contracted', u'.', u'...', u'albert', u'camus', u'search', u'meaning', u'midst']",2014-08-02,21,0,0.0,0,0.0,0,0.0,0,0.0,0,0.0,0,0.0,0,0.0
107,"[u'months', u'virus', u'wreaking', u'havoc', u'west', u'african', u'countries', u'guinea', u'liberia', u'sierra', u'leone', u'.', u'700', u'people', u'died', u'...', u'american', u'doctor', u'infected', u'returns', u'us']",2014-08-02,21,0,0.0,0,0.0,4,0.190476190476,1,0.047619047619,3,0.142857142857,1,0.047619047619,1,0.047619047619
108,"[u'american', u'doctor', u'stricken', u'west', u'africa', u'arrived', u'home', u'treatment', u'atlanta', u'saturday', u'u.s.', u'government', u'officials', u'urging', u'public', u'...', u'american', u'aid', u'worker', u'kent', u'brantly', u'infected', u'virus', u'arrives', u'...', u'in-depth', u'-', u'online']",2014-08-02,28,0,0.0,0,0.0,1,0.0357142857143,0,0.0,8,0.285714285714,0,0.0,1,0.0357142857143
